{
  "schemaVersion": 1,
  "releaseId": "release-20260716-001",
  "environment": "production",
  "currentState": "ARTIFACTS_READY",
  "completedStages": [
    "PREPARE",
    "IMAGES_PUBLISHED",
    "CLOUD_BUNDLE_READY",
    "SAFETY_CONTRACT_READY"
  ],
  "artifactHashes": {
    "releaseManifest": "aaaaaaaaaaaaaaaaaaaaaaaaaaaaaaaaaaaaaaaaaaaaaaaaaaaaaaaaaaaaaaaa",
    "imageLock": "bbbbbbbbbbbbbbbbbbbbbbbbbbbbbbbbbbbbbbbbbbbbbbbbbbbbbbbbbbbbbbbb",
    "cloudBundle": "cccccccccccccccccccccccccccccccccccccccccccccccccccccccccccccccc",
    "evidenceBundle": "dddddddddddddddddddddddddddddddddddddddddddddddddddddddddddddddd"
  },
  "updatedAt": "2026-07-16T08:30:00Z",
  "revision": 4
}
